{
  "dataset_id": "loan_approval",
  "path": "data/raw/loan_approval.csv",
  "target": {
    "column": "loan_status",
    "positive_class": "approved",
    "negative_class": "rejected"
  },
  "protected_attributes": [
    "gender",
    "race"
  ],
  "id_columns": [
    "applicant_id"
  ],
  "ignore_columns": [],
  "test_size": 0.2,
  "random_state": 42,
  "intersectional": {
    "min_group_size": 30
  },
  "model_config": {
    "algorithm": "LogisticRegression",
    "max_iter": 1000,
    "solver": "lbfgs"
  },
  "fairness_thresholds": {
    "demographic_parity_difference_max": 0.10,
    "disparate_impact_min": 0.80,
    "equal_opportunity_difference_max": 0.10,
    "equalized_odds_difference_max": 0.10,
    "fpr_difference_max": 0.10
  },
  "calibration_settings": {
    "n_bins": 10
  }
}
