{
  "dataset_id": "adult_census_income",
  "path": "data/benchmarks/adult_census_income.csv",
  "target": {
    "column": "income",
    "positive_class": ">50K"
  },
  "protected_attributes": [
    "sex",
    "race"
  ],
  "id_columns": [],
  "ignore_columns": [],
  "test_size": 0.2,
  "random_state": 42,
  "intersectional": {
    "min_group_size": 30
  },
  "model_config": {
    "algorithm": "LogisticRegression",
    "max_iter": 1000,
    "solver": "lbfgs"
  },
  "fairness_thresholds": {
    "demographic_parity_difference_max": 0.1,
    "disparate_impact_min": 0.8,
    "equal_opportunity_difference_max": 0.1,
    "equalized_odds_difference_max": 0.1,
    "fpr_difference_max": 0.1
  },
  "calibration_settings": {
    "n_bins": 10
  }
}