{
  "dataset_id": "test_persist_loan_demo",
  "path": "data/raw/test_persist_loan_demo.csv",
  "target": {
    "column": "loan_status",
    "positive_class": "approved"
  },
  "protected_attributes": [
    "gender",
    "race"
  ],
  "id_columns": [
    "applicant_id"
  ],
  "ignore_columns": [],
  "test_size": 0.25,
  "random_state": 123,
  "intersectional": {
    "min_group_size": 25
  },
  "model_config": {
    "algorithm": "LogisticRegression",
    "max_iter": 1000,
    "solver": "lbfgs"
  },
  "fairness_thresholds": {
    "demographic_parity_difference_max": 0.1,
    "disparate_impact_min": 0.8,
    "equal_opportunity_difference_max": 0.1,
    "equalized_odds_difference_max": 0.1,
    "fpr_difference_max": 0.1
  },
  "calibration_settings": {
    "n_bins": 10
  }
}